{
  "schema_version": "research_package_surface_matrix_v1",
  "task_id": "0820T001",
  "task_type": "research_package_infrastructure",
  "produces_research_package": true,
  "kernel_pin": {
    "mode": "bootstrap_candidate",
    "kernel_name": "research_package_trust_kernel",
    "candidate_version": "v1",
    "registry_path": "baselines/research_package_trust_kernel/accepted_versions.json",
    "registry_schema_path": ".workflow/workflow-kit/research-package-kernel-registry.schema.json"
  },
  "surfaces": [
    {
      "surface_id": "stage4_research_data_anchor",
      "description": "Immutable Stage 4 research-data bytes and the accepted 99-file durable inventory.",
      "artifacts": [
        {
          "path": "local_live_analysis/skhynix_trigger_aligned_episode_research_v1_stage04_jul30_episode_v3",
          "entry_type": "directory",
          "required": true
        },
        {
          "path": ".workflow/reports/0815T003-round4-pre-repair-research-inventory.csv",
          "entry_type": "regular_file",
          "required": true
        }
      ],
      "authoritative_sources": [
        {
          "source_id": "accepted_stage4_package",
          "source_type": "accepted_package",
          "locator": "local_live_analysis/skhynix_trigger_aligned_episode_research_v1_stage04_jul30_episode_v3",
          "identity": {
            "kind": "package_identity",
            "value": "669fb7d12f25cfa7828aec0fb1546398b1def754952de2290cd19784a477a433"
          }
        }
      ],
      "decision_time": {
        "kind": "final_publication",
        "field": null,
        "relation": "not_applicable",
        "clock": "publication_time",
        "observed_at_rule": "Use only the package accepted by 0815T003 QA Round 6; no row is recomputed or re-timed."
      },
      "availability": {
        "state": "available"
      },
      "exact_contract": {
        "key_fields": [
          "path"
        ],
        "ordered_fields": [
          "path",
          "bytes",
          "sha256"
        ],
        "unknown_key_policy": "reject",
        "unknown_field_policy": "reject",
        "canonicalization": "canonical_csv",
        "value_contract": "Exactly 99 accepted research files, 1560514934 bytes, canonical inventory SHA256 bb5aed2099b1a97da5b476d4b09dfe4a7bac06f0bf331f8ca864a88daf5c9232.",
        "row_identity": "SHA256 of canonical ordered path, bytes and raw file SHA256 rows.",
        "schema_path": null,
        "schema_sha256": null
      },
      "rebuild_oracle": {
        "mode": "exact_bytes",
        "entrypoint": "examples/hyperliquid/research_package_trust_stage4_adapter.py --verify-research-data-anchor",
        "expected_evidence": [
          "research_file_count",
          "research_total_bytes",
          "research_inventory_sha256"
        ]
      },
      "negative_mutations": [
        {
          "mutation_id": "mutate_stage4_research_byte",
          "target": "one accepted research CSV or GZ byte",
          "operation": "alter_value",
          "description": "A one-byte research-data mutation must change R and reject reuse of the old C and E bindings.",
          "expected_error_code": "RESEARCH_DATA_IDENTITY_MISMATCH"
        }
      ],
      "durable_evidence": {
        "required": true,
        "path": ".workflow/reports/0815T003-round4-pre-repair-research-inventory.csv",
        "sha256": "07521dbc2c8bfe5f41a3ab14ac5493591dad878d52053b2d74aad251b9f022df",
        "claim": "Accepted Stage 4 research-data bytes remain unchanged across Trust Kernel extraction."
      },
      "identity_layer": "R",
      "depends_on_surfaces": []
    },
    {
      "surface_id": "kernel_runtime_contract",
      "description": "Pure versioned Trust Kernel source, public API, compatibility adapter and permanent tests.",
      "artifacts": [
        {
          "path": "examples/hyperliquid/research_package_trust",
          "entry_type": "directory",
          "required": true
        },
        {
          "path": "examples/hyperliquid/research_package_trust_cli.py",
          "entry_type": "regular_file",
          "required": true
        },
        {
          "path": "examples/hyperliquid/research_package_trust_stage4_adapter.py",
          "entry_type": "regular_file",
          "required": true
        },
        {
          "path": "examples/hyperliquid/test_research_package_trust_evidence.py",
          "entry_type": "regular_file",
          "required": true
        },
        {
          "path": "examples/hyperliquid/test_research_package_trust_tree.py",
          "entry_type": "regular_file",
          "required": true
        },
        {
          "path": "examples/hyperliquid/test_research_package_trust_identity.py",
          "entry_type": "regular_file",
          "required": true
        },
        {
          "path": "examples/hyperliquid/test_research_package_trust_publication.py",
          "entry_type": "regular_file",
          "required": true
        },
        {
          "path": "examples/hyperliquid/test_research_package_trust_stage4_parity.py",
          "entry_type": "regular_file",
          "required": true
        }
      ],
      "authoritative_sources": [
        {
          "source_id": "trust_kernel_execution_plan",
          "source_type": "kernel_contract",
          "locator": "docs/research_package_trust_kernel_execution_plan.md",
          "identity": {
            "kind": "sha256",
            "value": "db8c5fa78d362d465cc03b4f9308d953d46319ffd583a47ac478344b13ffa2e5"
          }
        }
      ],
      "decision_time": {
        "kind": "not_applicable",
        "field": null,
        "relation": "not_applicable",
        "clock": "not_applicable",
        "observed_at_rule": "The kernel is deterministic infrastructure and may not read a clock, market timestamp or current date."
      },
      "availability": {
        "state": "available"
      },
      "exact_contract": {
        "key_fields": [
          "relative_source_path"
        ],
        "ordered_fields": [
          "relative_source_path",
          "bytes",
          "sha256"
        ],
        "unknown_key_policy": "reject",
        "unknown_field_policy": "reject",
        "canonicalization": "canonical_json",
        "value_contract": "The v1 source tree, public API contract, stable error-code universe and tests are exact candidate bytes.",
        "row_identity": "SHA256 of canonical source-tree inventory rows.",
        "schema_path": null,
        "schema_sha256": null
      },
      "rebuild_oracle": {
        "mode": "deterministic_derivation",
        "entrypoint": "python3 -m pytest examples/hyperliquid/test_research_package_trust_evidence.py examples/hyperliquid/test_research_package_trust_tree.py examples/hyperliquid/test_research_package_trust_identity.py examples/hyperliquid/test_research_package_trust_publication.py",
        "expected_evidence": [
          "kernel_source_tree_sha256",
          "kernel_api_contract_sha256",
          "stable_error_code_summary",
          "negative_matrix_counts"
        ]
      },
      "negative_mutations": [
        {
          "mutation_id": "inject_domain_constant_into_kernel",
          "target": "kernel source tree",
          "operation": "insert",
          "description": "Adding a SKHYNIX, session, family or accepted-count constant to generic kernel source must fail the purity scan.",
          "expected_error_code": "KERNEL_PURITY_VIOLATION"
        },
        {
          "mutation_id": "drift_kernel_source_same_version",
          "target": "kernel source tree",
          "operation": "alter_value",
          "description": "Changing any source byte while retaining candidate version v1 must change the source-tree identity and invalidate receipts.",
          "expected_error_code": "KERNEL_SOURCE_IDENTITY_MISMATCH"
        }
      ],
      "durable_evidence": {
        "required": false,
        "reason": "new_surface_no_prior_version"
      },
      "identity_layer": "C",
      "depends_on_surfaces": []
    },
    {
      "surface_id": "workflow_governance_contract",
      "description": "Research-package task template, schemas, validator and this task's canonical surface matrix.",
      "artifacts": [
        {
          "path": ".workflow/workflow-kit/research-package-task-template.md",
          "entry_type": "regular_file",
          "required": true
        },
        {
          "path": ".workflow/workflow-kit/validate_research_package_task.py",
          "entry_type": "regular_file",
          "required": true
        },
        {
          "path": ".workflow/workflow-kit/research-package-surface-matrix.schema.json",
          "entry_type": "regular_file",
          "required": true
        },
        {
          "path": ".workflow/workflow-kit/research-package-kernel-registry.schema.json",
          "entry_type": "regular_file",
          "required": true
        },
        {
          "path": ".workflow/contracts/0820T001-surface-matrix.json",
          "entry_type": "regular_file",
          "required": true
        },
        {
          "path": ".workflow/tasks/0820T001.md",
          "entry_type": "regular_file",
          "required": true
        }
      ],
      "authoritative_sources": [
        {
          "source_id": "frozen_surface_schema",
          "source_type": "kernel_contract",
          "locator": ".workflow/workflow-kit/research-package-surface-matrix.schema.json",
          "identity": {
            "kind": "sha256",
            "value": "fa6e10608855d7ff781be8ffd8d64b713244fe81db30ed70b8502e40244261d8"
          }
        },
        {
          "source_id": "frozen_registry_schema",
          "source_type": "kernel_contract",
          "locator": ".workflow/workflow-kit/research-package-kernel-registry.schema.json",
          "identity": {
            "kind": "sha256",
            "value": "72ba717c6ba1a9fe288c36174c05d1d23ef37db45213f6010f9446d5fba8197b"
          }
        }
      ],